{
  "$schema": "https://json-schema.org/draft/2020-12/schema",
  "type": "object",
  "properties": {
    "$schema": {
      "type": "string"
    },
    "schemaVersion": {
      "type": "number",
      "const": 1
    },
    "dataVersion": {
      "type": "string"
    },
    "updatedAt": {
      "type": "string",
      "pattern": "^\\d{4}-\\d{2}-\\d{2}$"
    },
    "source": {
      "type": "object",
      "properties": {
        "name": {
          "type": "string"
        },
        "author": {
          "type": "string"
        },
        "url": {
          "type": "string",
          "format": "uri"
        },
        "note": {
          "type": "string"
        }
      },
      "required": [
        "name",
        "author",
        "url",
        "note"
      ],
      "additionalProperties": false
    },
    "edgeTypes": {
      "minItems": 3,
      "maxItems": 3,
      "type": "array",
      "items": {
        "type": "object",
        "properties": {
          "id": {
            "type": "string",
            "enum": [
              "must",
              "should",
              "could"
            ]
          },
          "label": {
            "type": "string"
          },
          "description": {
            "type": "string"
          },
          "weight": {
            "type": "integer",
            "minimum": -9007199254740991,
            "maximum": 9007199254740991
          }
        },
        "required": [
          "id",
          "label",
          "description",
          "weight"
        ],
        "additionalProperties": false
      }
    },
    "titles": {
      "minItems": 1,
      "type": "array",
      "items": {
        "type": "object",
        "properties": {
          "id": {
            "type": "string",
            "pattern": "^[a-z0-9]+(?:-[a-z0-9]+)*$"
          },
          "title": {
            "type": "string",
            "minLength": 1
          },
          "year": {
            "type": "integer",
            "minimum": 1930,
            "maximum": 2100
          },
          "releaseDate": {
            "anyOf": [
              {
                "type": "string",
                "pattern": "^\\d{4}-\\d{2}-\\d{2}$"
              },
              {
                "type": "null"
              }
            ]
          },
          "kind": {
            "type": "string",
            "enum": [
              "film",
              "series",
              "special",
              "short",
              "one-shot",
              "animation",
              "collection"
            ]
          },
          "phase": {
            "type": "string",
            "minLength": 1
          },
          "saga": {
            "type": "string",
            "minLength": 1
          },
          "seasons": {
            "type": "integer",
            "exclusiveMinimum": 0,
            "maximum": 9007199254740991
          },
          "show": {
            "type": "string",
            "pattern": "^[a-z0-9]+(?:-[a-z0-9]+)*$"
          },
          "season": {
            "type": "integer",
            "exclusiveMinimum": 0,
            "maximum": 9007199254740991
          },
          "runtimeMinutes": {
            "type": "integer",
            "exclusiveMinimum": 0,
            "maximum": 9007199254740991
          },
          "orderGroup": {
            "type": "integer",
            "minimum": 0,
            "maximum": 9007199254740991
          },
          "tmdbQuery": {
            "type": "string",
            "minLength": 1
          },
          "imdbId": {
            "type": "string",
            "pattern": "^tt\\d{7,9}$"
          },
          "disneyPlusId": {
            "type": "string",
            "pattern": "^[0-9a-f]{8}-(?:[0-9a-f]{4}-){3}[0-9a-f]{12}$"
          },
          "providers": {
            "type": "array",
            "items": {
              "type": "string",
              "minLength": 1
            }
          },
          "note": {
            "type": "string"
          }
        },
        "required": [
          "id",
          "title",
          "year",
          "releaseDate",
          "kind",
          "phase",
          "saga"
        ],
        "additionalProperties": false
      }
    },
    "edges": {
      "type": "array",
      "items": {
        "type": "object",
        "properties": {
          "from": {
            "type": "string",
            "pattern": "^[a-z0-9]+(?:-[a-z0-9]+)*$"
          },
          "to": {
            "type": "string",
            "pattern": "^[a-z0-9]+(?:-[a-z0-9]+)*$"
          },
          "type": {
            "type": "string",
            "enum": [
              "must",
              "should",
              "could"
            ]
          },
          "provisional": {
            "type": "boolean"
          },
          "note": {
            "type": "string"
          }
        },
        "required": [
          "from",
          "to",
          "type"
        ],
        "additionalProperties": false
      }
    }
  },
  "required": [
    "schemaVersion",
    "dataVersion",
    "updatedAt",
    "source",
    "edgeTypes",
    "titles",
    "edges"
  ],
  "additionalProperties": false
}
