{
  "$schema": "./marvel-graph.schema.json",
  "schemaVersion": 1,
  "dataVersion": "2026.03.005",
  "updatedAt": "2026-10-21",
  "source": {
    "name": "A smarter MCU watch order (ver. 003, March 2026)",
    "author": "Rocked03",
    "url": "https://www.reddit.com/r/marvelstudios/s/Yc9CunxbWr",
    "note": "Titles and story-dependency edges are a best-effort transcription of the chart. The chart's own disclaimer applies: the labels are subjective and the lines between levels are blurry. Corrections are welcome - edit this one file and open a PR."
  },
  "edgeTypes": [
    {
      "id": "must",
      "label": "Must watch",
      "description": "Continues story/character development that you are expected to be familiar with.",
      "weight": 3
    },
    {
      "id": "should",
      "label": "Should watch",
      "description": "Continues story/character development that it adequately recaps enough to understand.",
      "weight": 2
    },
    {
      "id": "could",
      "label": "Could watch",
      "description": "References story that you're not expected to be familiar with (not including easter eggs).",
      "weight": 1
    }
  ],
  "titles": [
    { "id": "iron-man", "title": "Iron Man", "year": 2008, "releaseDate": "2008-05-02", "kind": "film", "phase": "Phase One", "saga": "The Infinity Saga", "imdbId": "tt0371746", "providers": ["disney-plus"] },
    { "id": "the-incredible-hulk", "title": "The Incredible Hulk", "year": 2008, "releaseDate": "2008-06-13", "kind": "film", "phase": "Phase One", "saga": "The Infinity Saga", "imdbId": "tt0800080", "providers": ["disney-plus"] },
    { "id": "the-consultant", "title": "The Consultant", "year": 2011, "releaseDate": "2011-09-13", "kind": "one-shot", "phase": "Phase One", "saga": "The Infinity Saga", "runtimeMinutes": 4, "providers": ["disney-plus"] },
    { "id": "iron-man-2", "title": "Iron Man 2", "year": 2010, "releaseDate": "2010-05-07", "kind": "film", "phase": "Phase One", "saga": "The Infinity Saga", "imdbId": "tt1228705", "providers": ["disney-plus"] },
    { "id": "thor", "title": "Thor", "year": 2011, "releaseDate": "2011-05-06", "kind": "film", "phase": "Phase One", "saga": "The Infinity Saga", "imdbId": "tt0800369", "providers": ["disney-plus"] },
    { "id": "thors-hammer", "title": "A Funny Thing Happened on the Way to Thor's Hammer", "year": 2011, "releaseDate": "2011-10-25", "kind": "one-shot", "phase": "Phase One", "saga": "The Infinity Saga", "runtimeMinutes": 4, "providers": ["disney-plus"] },
    { "id": "captain-america-the-first-avenger", "title": "Captain America: The First Avenger", "year": 2011, "releaseDate": "2011-07-22", "kind": "film", "phase": "Phase One", "saga": "The Infinity Saga", "imdbId": "tt0458339", "providers": ["disney-plus"] },
    { "id": "agent-carter-one-shot", "title": "Agent Carter (one-shot)", "tmdbQuery": "Marvel One-Shot: Agent Carter", "year": 2013, "releaseDate": "2013-09-08", "kind": "one-shot", "phase": "Phase Two", "saga": "The Infinity Saga", "runtimeMinutes": 15, "providers": ["disney-plus"] },
    { "id": "the-avengers", "title": "The Avengers", "year": 2012, "releaseDate": "2012-05-04", "kind": "film", "phase": "Phase One", "saga": "The Infinity Saga", "imdbId": "tt0848228", "providers": ["disney-plus"] },
    { "id": "item-47", "title": "Item 47", "year": 2012, "releaseDate": "2012-09-25", "kind": "one-shot", "phase": "Phase Two", "saga": "The Infinity Saga", "runtimeMinutes": 12, "providers": ["disney-plus"] },
    { "id": "agent-carter", "title": "Agent Carter", "year": 2015, "releaseDate": "2015-01-06", "kind": "series", "phase": "Marvel Television", "saga": "The Infinity Saga", "seasons": 2, "imdbId": "tt3475734", "providers": ["disney-plus"] },
    { "id": "iron-man-3", "title": "Iron Man 3", "year": 2013, "releaseDate": "2013-05-03", "kind": "film", "phase": "Phase Two", "saga": "The Infinity Saga", "imdbId": "tt1300854", "providers": ["disney-plus"] },
    { "id": "all-hail-the-king", "title": "All Hail the King", "year": 2014, "releaseDate": "2014-02-04", "kind": "one-shot", "phase": "Phase Two", "saga": "The Infinity Saga", "runtimeMinutes": 14, "providers": ["disney-plus"] },
    { "id": "thor-the-dark-world", "title": "Thor: The Dark World", "year": 2013, "releaseDate": "2013-11-08", "kind": "film", "phase": "Phase Two", "saga": "The Infinity Saga", "imdbId": "tt1981115", "providers": ["disney-plus"] },
    { "id": "captain-america-the-winter-soldier", "title": "Captain America: The Winter Soldier", "year": 2014, "releaseDate": "2014-04-04", "kind": "film", "phase": "Phase Two", "saga": "The Infinity Saga", "imdbId": "tt1843866", "providers": ["disney-plus"] },
    { "id": "guardians-of-the-galaxy", "title": "Guardians of the Galaxy", "year": 2014, "releaseDate": "2014-08-01", "kind": "film", "phase": "Phase Two", "saga": "The Infinity Saga", "imdbId": "tt2015381", "providers": ["disney-plus"] },
    { "id": "avengers-age-of-ultron", "title": "Avengers: Age of Ultron", "year": 2015, "releaseDate": "2015-05-01", "kind": "film", "phase": "Phase Two", "saga": "The Infinity Saga", "imdbId": "tt2395427", "providers": ["disney-plus"] },
    { "id": "ant-man", "title": "Ant-Man", "year": 2015, "releaseDate": "2015-07-17", "kind": "film", "phase": "Phase Two", "saga": "The Infinity Saga", "imdbId": "tt0478970", "providers": ["disney-plus"] },
    { "id": "agents-of-shield", "title": "Agents of S.H.I.E.L.D.", "year": 2013, "releaseDate": "2013-09-24", "kind": "series", "phase": "Marvel Television", "saga": "The Infinity Saga", "seasons": 7, "imdbId": "tt2364582", "providers": ["disney-plus"] },
    { "id": "inhumans", "title": "Inhumans", "year": 2017, "releaseDate": "2017-09-29", "kind": "series", "phase": "Marvel Television", "saga": "The Infinity Saga", "seasons": 1, "providers": ["disney-plus", "hulu"] },
    { "id": "helstrom", "title": "Helstrom", "year": 2020, "releaseDate": "2020-10-16", "kind": "series", "phase": "Marvel Television", "saga": "Standalone", "seasons": 1, "providers": ["disney-plus", "hulu"] },
    { "id": "cloak-and-dagger", "title": "Cloak & Dagger", "year": 2018, "releaseDate": "2018-06-07", "kind": "series", "phase": "Marvel Television", "saga": "Standalone", "seasons": 2, "providers": ["disney-plus", "hulu"] },
    { "id": "runaways", "title": "Runaways", "year": 2017, "releaseDate": "2017-11-21", "kind": "series", "phase": "Marvel Television", "saga": "Standalone", "seasons": 3, "providers": ["disney-plus", "hulu"] },
    { "id": "x-men-the-animated-series", "title": "X-Men: The Animated Series", "year": 1992, "releaseDate": "1992-10-31", "kind": "animation", "phase": "Animation", "saga": "X-Men", "seasons": 5, "orderGroup": 1, "providers": ["disney-plus"] },
    { "id": "x-men-97", "title": "X-Men '97", "year": 2024, "releaseDate": "2024-03-20", "kind": "animation", "phase": "Animation", "saga": "X-Men", "seasons": 1, "orderGroup": 1, "providers": ["disney-plus"] },
    { "id": "captain-america-civil-war", "title": "Captain America: Civil War", "year": 2016, "releaseDate": "2016-05-06", "kind": "film", "phase": "Phase Three", "saga": "The Infinity Saga", "imdbId": "tt3498820", "providers": ["disney-plus"] },
    { "id": "thor-ragnarok", "title": "Thor: Ragnarok", "year": 2017, "releaseDate": "2017-11-03", "kind": "film", "phase": "Phase Three", "saga": "The Infinity Saga", "imdbId": "tt3501632", "providers": ["disney-plus"] },
    { "id": "doctor-strange", "title": "Doctor Strange", "year": 2016, "releaseDate": "2016-11-04", "kind": "film", "phase": "Phase Three", "saga": "The Infinity Saga", "imdbId": "tt1211837", "providers": ["disney-plus"] },
    { "id": "team-thor", "title": "Team Thor", "year": 2016, "releaseDate": "2016-08-28", "kind": "short", "phase": "Phase Three", "saga": "The Infinity Saga", "runtimeMinutes": 4, "providers": ["disney-plus"] },
    { "id": "team-thor-part-2", "title": "Team Thor: Part 2", "year": 2017, "releaseDate": "2017-03-14", "kind": "short", "phase": "Phase Three", "saga": "The Infinity Saga", "runtimeMinutes": 4, "providers": ["disney-plus"] },
    { "id": "team-darryl", "title": "Team Darryl", "year": 2018, "releaseDate": "2018-03-06", "kind": "short", "phase": "Phase Three", "saga": "The Infinity Saga", "runtimeMinutes": 4, "providers": ["disney-plus"] },
    { "id": "spider-man-homecoming", "title": "Spider-Man: Homecoming", "year": 2017, "releaseDate": "2017-07-07", "kind": "film", "phase": "Phase Three", "saga": "The Infinity Saga", "imdbId": "tt2250912", "providers": ["disney-plus"] },
    { "id": "black-panther", "title": "Black Panther", "year": 2018, "releaseDate": "2018-02-16", "kind": "film", "phase": "Phase Three", "saga": "The Infinity Saga", "imdbId": "tt1825683", "providers": ["disney-plus"] },
    { "id": "ant-man-and-the-wasp", "title": "Ant-Man and the Wasp", "year": 2018, "releaseDate": "2018-07-06", "kind": "film", "phase": "Phase Three", "saga": "The Infinity Saga", "imdbId": "tt5095030", "providers": ["disney-plus"] },
    { "id": "captain-marvel", "title": "Captain Marvel", "year": 2019, "releaseDate": "2019-03-08", "kind": "film", "phase": "Phase Three", "saga": "The Infinity Saga", "imdbId": "tt4154664", "providers": ["disney-plus"] },
    { "id": "guardians-of-the-galaxy-vol-2", "title": "Guardians of the Galaxy Vol. 2", "year": 2017, "releaseDate": "2017-05-05", "kind": "film", "phase": "Phase Three", "saga": "The Infinity Saga", "imdbId": "tt3896198", "providers": ["disney-plus"] },
    { "id": "your-friendly-neighborhood-spider-man", "title": "Your Friendly Neighborhood Spider-Man", "year": 2025, "releaseDate": "2025-01-29", "kind": "animation", "phase": "Animation", "saga": "Standalone", "seasons": 1, "providers": ["disney-plus"] },